full_text,cleaned
Pasangan capres-cawapres nomor urut 2 Prabowo Subianto-Gibran Rakabuming Raka akan kembali berkampanye pada Minggu (3/12/2023). #PrabowoGibranIstimewa #BersamaIndonesiaMaju #PrabowoGemoy Prabowo Subianto,pasang capres-cawapres nomor urut prabowo subianto-gibran rakabuming raka kampanye minggu prabowo subianto
"Ya kita membahas Undang-Undang Pesantren, yang masih perlu, pelaksanaannya, implementasinya, nanti kita akan konsultasi dengan tokoh-tokoh pesantren, dan majelis massyayikh,"" kata Prabowo di lokasi. #PrabowoGibranIstimewa #BersamaIndonesiaMaju #PrabowoGemoy Prabowo Subianto""",iya bahas undang pesantren laksana implementasi konsultasi tokoh pesantren majelis massyayikh  prabowo lokasi prabowo subianto 
"Prabowo Doa Bersama Kiai di Banten Hari Ini, Gibran ke CFD Jakarta #PrabowoGibranIstimewa #BersamaIndonesiaMaju #PrabowoGemoy Prabowo Subianto https://t.co/6hwIIOt4o9",prabowo doa kiai banten gibran cfd jakarta prabowo subianto
"Dalam pertemuan itu, Prabowo menekankan komitmennya atas implementasi Undang-Undang (UU) Nomor 18 Tahun 2019 tentang Pesantren yang disahkan Presiden Joko Widodo. #PrabowoGibranIstimewa #BersamaIndonesiaMaju #PrabowoGemoy Prabowo Subianto",temu prabowo tekan komitmen implementasi undang uu nomor pesantren sah presiden joko widodo prabowo subianto
"Masih di Tasikmalaya, Prabowo melanjutkan kunjungannya ke Pondok Pesantren (Ponpes) Cipasung. #PrabowoGibranIstimewa #BersamaIndonesiaMaju #PrabowoGemoy Prabowo Subianto",tasikmalaya prabowo lanjut kunjung pondok pesantren pondok pesantren cipasung prabowo subianto
@gibran_gen @gibran_tweet @prabowo Gibran sangat digemari berbagai lapisan masyarakat,gibran gari lapis masyarakat
Prabowo Komitmen Implementasikan UU Pesantren #PrabowoGibranIstimewa #BersamaIndonesiaMaju #PrabowoGemoy Prabowo Subianto,prabowo komitmen implementasi uu pesantren prabowo subianto
"Beliau ingin rakyat Indonesia berdiri di atas kakinya sendiri, lanjut Prabowo. #PrabowoGibranIstimewa #BersamaIndonesiaMaju #PrabowoGemoy Prabowo Subianto""",beliau rakyat indonesia diri kaki prabowo prabowo subianto 
"Beliau kalahkan saya tapi beliau ajak bersatu untuk rakyat Indonesia. Setelah saya bergabung, saya melihat beliau sangat mencintai rakyat Indonesia. #PrabowoGibranIstimewa #BersamaIndonesiaMaju #PrabowoGemoy Prabowo Subianto""",beliau kalah beliau ajak satu rakyat indonesia gabung beliau cinta rakyat indonesia prabowo subianto 
"Dan kalian tahu waktu itu paket kita paket hemat waktu itu. Sekarang Pak Jokowi telah mengajak saya bersatu,"" kata Menteri Pertahanan (Menhan) itu. #PrabowoGibranIstimewa #BersamaIndonesiaMaju #PrabowoGemoy Prabowo Subianto""",paket paket hemat jokowi ajak satu  menteri tahan menhan prabowo subianto 
"Namun, kata dia, saat ini Presiden Jokowi telah mengajaknya bersatu dalam pemerintahan. #PrabowoGibranIstimewa #BersamaIndonesiaMaju #PrabowoGemoy Prabowo Subianto",presiden jokowi ajak satu perintah prabowo subianto
"Ia mengibaratkan dirinya bersama cawapresnya di Pilpres 2019, Sandiaga Uno, seperti paket hemat. #PrabowoGibranIstimewa #BersamaIndonesiaMaju #PrabowoGemoy Prabowo Subianto",cawapresnya pilpres sandiaga uno paket hemat prabowo subianto
Prabowo kemudian mengenang masa-masa Pilpres 2019. #PrabowoGibranIstimewa #BersamaIndonesiaMaju #PrabowoGemoy Prabowo Subianto,prabowo kenang masa pilpres prabowo subianto
ujar Prabowo disambut riuh pendukung. #PrabowoGibranIstimewa #BersamaIndonesiaMaju #PrabowoGemoy Prabowo Subianto,prabowo sambut riuh dukung prabowo subianto
